<?xml version="1.0" encoding="UTF-8"?>
<!--Sample XML file generated by XMLSpy v2021 (x64) (http://www.altova.com)-->
<fitness xmlns:xsi="http://www.w3.org/2001/XMLSchema-instance" xsi:noNamespaceSchemaLocation="fitness2.xsd">
	<users>
		<user>
			<userID>1</userID>
			<name>Pablo</name>
			<weight>3.141590118408203125</weight>
			<height>3.141590118408203125</height>
			<imc>3.141590118408203125</imc>
			<favoriteExecises>
				<exerciseName>String</exerciseName>
				<description>String</description>
				<URLVideo>String</URLVideo>
				<duration>0</duration>
				<reps>0</reps>
				<calories>0</calories>
				<dificulty>0</dificulty>
				<date>text</date>
			</favoriteExecises>
			<favoriteExecises>
				<exerciseName>String</exerciseName>
				<description>String</description>
				<URLVideo>String</URLVideo>
				<duration>0</duration>
				<reps>0</reps>
				<calories>0</calories>
				<dificulty>0</dificulty>
				<date>text</date>
			</favoriteExecises>
			<favoriteExecises>
				<exerciseName>String</exerciseName>
				<description>String</description>
				<URLVideo>String</URLVideo>
				<duration>0</duration>
				<reps>0</reps>
				<calories>0</calories>
				<dificulty>0</dificulty>
				<date>text</date>
			</favoriteExecises>
			<asignedWorkouts>
				<workoutName>String</workoutName>
				<exercise>
					<exerciseName>String</exerciseName>
					<description>String</description>
					<URLVideo>String</URLVideo>
					<duration>0</duration>
					<reps>0</reps>
					<calories>0</calories>
					<dificulty>0</dificulty>
				</exercise>
				<exercise>
					<exerciseName>String</exerciseName>
					<description>String</description>
					<URLVideo>String</URLVideo>
					<duration>0</duration>
					<reps>0</reps>
					<calories>0</calories>
					<dificulty>0</dificulty>
				</exercise>
				<exercise>
					<exerciseName>String</exerciseName>
					<description>String</description>
					<URLVideo>String</URLVideo>
					<duration>0</duration>
					<reps>0</reps>
					<calories>0</calories>
					<dificulty>0</dificulty>
				</exercise>
				<totalCalories>0</totalCalories>
				<difficulty>0</difficulty>
				<workoutDone>true</workoutDone>
			</asignedWorkouts>
			<asignedWorkouts>
				<workoutName>String</workoutName>
				<exercise>
					<exerciseName>String</exerciseName>
					<description>String</description>
					<URLVideo>String</URLVideo>
					<duration>0</duration>
					<reps>0</reps>
					<calories>0</calories>
					<dificulty>0</dificulty>
				</exercise>
				<exercise>
					<exerciseName>String</exerciseName>
					<description>String</description>
					<URLVideo>String</URLVideo>
					<duration>0</duration>
					<reps>0</reps>
					<calories>0</calories>
					<dificulty>0</dificulty>
				</exercise>
				<exercise>
					<exerciseName>String</exerciseName>
					<description>String</description>
					<URLVideo>String</URLVideo>
					<duration>0</duration>
					<reps>0</reps>
					<calories>0</calories>
					<dificulty>0</dificulty>
				</exercise>
				<totalCalories>0</totalCalories>
				<difficulty>0</difficulty>
				<workoutDone>true</workoutDone>
			</asignedWorkouts>
			<asignedWorkouts>
				<workoutName>String</workoutName>
				<exercise>
					<exerciseName>String</exerciseName>
					<description>String</description>
					<URLVideo>String</URLVideo>
					<duration>0</duration>
					<reps>0</reps>
					<calories>0</calories>
					<dificulty>0</dificulty>
				</exercise>
				<exercise>
					<exerciseName>String</exerciseName>
					<description>String</description>
					<URLVideo>String</URLVideo>
					<duration>0</duration>
					<reps>0</reps>
					<calories>0</calories>
					<dificulty>0</dificulty>
				</exercise>
				<exercise>
					<exerciseName>String</exerciseName>
					<description>String</description>
					<URLVideo>String</URLVideo>
					<duration>0</duration>
					<reps>0</reps>
					<calories>0</calories>
					<dificulty>0</dificulty>
				</exercise>
				<totalCalories>0</totalCalories>
				<difficulty>0</difficulty>
				<workoutDone>true</workoutDone>
			</asignedWorkouts>
		</user>
		<user>
			<userID>2</userID>
			<name>String</name>
			<weight>3.141590118408203125</weight>
			<height>3.141590118408203125</height>
			<imc>3.141590118408203125</imc>
			<favoriteExecises>
				<exerciseName>String</exerciseName>
				<description>String</description>
				<URLVideo>String</URLVideo>
				<duration>0</duration>
				<reps>0</reps>
				<calories>0</calories>
				<dificulty>0</dificulty>
				<date>text</date>
			</favoriteExecises>
			<favoriteExecises>
				<exerciseName>String</exerciseName>
				<description>String</description>
				<URLVideo>String</URLVideo>
				<duration>0</duration>
				<reps>0</reps>
				<calories>0</calories>
				<dificulty>0</dificulty>
				<date>text</date>
			</favoriteExecises>
			<favoriteExecises>
				<exerciseName>String</exerciseName>
				<description>String</description>
				<URLVideo>String</URLVideo>
				<duration>0</duration>
				<reps>0</reps>
				<calories>0</calories>
				<dificulty>0</dificulty>
				<date>text</date>
			</favoriteExecises>
			<asignedWorkouts>
				<workoutName>String</workoutName>
				<exercise>
					<exerciseName>String</exerciseName>
					<description>String</description>
					<URLVideo>String</URLVideo>
					<duration>0</duration>
					<reps>0</reps>
					<calories>0</calories>
					<dificulty>0</dificulty>
				</exercise>
				<exercise>
					<exerciseName>String</exerciseName>
					<description>String</description>
					<URLVideo>String</URLVideo>
					<duration>0</duration>
					<reps>0</reps>
					<calories>0</calories>
					<dificulty>0</dificulty>
				</exercise>
				<exercise>
					<exerciseName>String</exerciseName>
					<description>String</description>
					<URLVideo>String</URLVideo>
					<duration>0</duration>
					<reps>0</reps>
					<calories>0</calories>
					<dificulty>0</dificulty>
				</exercise>
				<totalCalories>0</totalCalories>
				<difficulty>0</difficulty>
				<workoutDone>true</workoutDone>
			</asignedWorkouts>
			<asignedWorkouts>
				<workoutName>String</workoutName>
				<exercise>
					<exerciseName>String</exerciseName>
					<description>String</description>
					<URLVideo>String</URLVideo>
					<duration>0</duration>
					<reps>0</reps>
					<calories>0</calories>
					<dificulty>0</dificulty>
				</exercise>
				<exercise>
					<exerciseName>String</exerciseName>
					<description>String</description>
					<URLVideo>String</URLVideo>
					<duration>0</duration>
					<reps>0</reps>
					<calories>0</calories>
					<dificulty>0</dificulty>
				</exercise>
				<exercise>
					<exerciseName>String</exerciseName>
					<description>String</description>
					<URLVideo>String</URLVideo>
					<duration>0</duration>
					<reps>0</reps>
					<calories>0</calories>
					<dificulty>0</dificulty>
				</exercise>
				<totalCalories>0</totalCalories>
				<difficulty>0</difficulty>
				<workoutDone>true</workoutDone>
			</asignedWorkouts>
			<asignedWorkouts>
				<workoutName>String</workoutName>
				<exercise>
					<exerciseName>String</exerciseName>
					<description>String</description>
					<URLVideo>String</URLVideo>
					<duration>0</duration>
					<reps>0</reps>
					<calories>0</calories>
					<dificulty>0</dificulty>
				</exercise>
				<exercise>
					<exerciseName>String</exerciseName>
					<description>String</description>
					<URLVideo>String</URLVideo>
					<duration>0</duration>
					<reps>0</reps>
					<calories>0</calories>
					<dificulty>0</dificulty>
				</exercise>
				<exercise>
					<exerciseName>String</exerciseName>
					<description>String</description>
					<URLVideo>String</URLVideo>
					<duration>0</duration>
					<reps>0</reps>
					<calories>0</calories>
					<dificulty>0</dificulty>
				</exercise>
				<totalCalories>0</totalCalories>
				<difficulty>0</difficulty>
				<workoutDone>true</workoutDone>
			</asignedWorkouts>
		</user>
		<user>
			<userID>3</userID>
			<name>String</name>
			<weight>3.141590118408203125</weight>
			<height>3.141590118408203125</height>
			<imc>3.141590118408203125</imc>
			<favoriteExecises>
				<exerciseName>String</exerciseName>
				<description>String</description>
				<URLVideo>String</URLVideo>
				<duration>0</duration>
				<reps>0</reps>
				<calories>0</calories>
				<dificulty>0</dificulty>
				<date>text</date>
			</favoriteExecises>
			<favoriteExecises>
				<exerciseName>String</exerciseName>
				<description>String</description>
				<URLVideo>String</URLVideo>
				<duration>0</duration>
				<reps>0</reps>
				<calories>0</calories>
				<dificulty>0</dificulty>
				<date>text</date>
			</favoriteExecises>
			<favoriteExecises>
				<exerciseName>String</exerciseName>
				<description>String</description>
				<URLVideo>String</URLVideo>
				<duration>0</duration>
				<reps>0</reps>
				<calories>0</calories>
				<dificulty>0</dificulty>
				<date>text</date>
			</favoriteExecises>
			<asignedWorkouts>
				<workoutName>String</workoutName>
				<exercise>
					<exerciseName>String</exerciseName>
					<description>String</description>
					<URLVideo>String</URLVideo>
					<duration>0</duration>
					<reps>0</reps>
					<calories>0</calories>
					<dificulty>0</dificulty>
				</exercise>
				<exercise>
					<exerciseName>String</exerciseName>
					<description>String</description>
					<URLVideo>String</URLVideo>
					<duration>0</duration>
					<reps>0</reps>
					<calories>0</calories>
					<dificulty>0</dificulty>
				</exercise>
				<exercise>
					<exerciseName>String</exerciseName>
					<description>String</description>
					<URLVideo>String</URLVideo>
					<duration>0</duration>
					<reps>0</reps>
					<calories>0</calories>
					<dificulty>0</dificulty>
				</exercise>
				<totalCalories>0</totalCalories>
				<difficulty>0</difficulty>
				<workoutDone>true</workoutDone>
			</asignedWorkouts>
			<asignedWorkouts>
				<workoutName>String</workoutName>
				<exercise>
					<exerciseName>String</exerciseName>
					<description>String</description>